{
  "contract_version": "2.0",
  "agent_name": "support-ticket-agent",
  "logical_version": "issue-035",
  "data_class": "synthetic_public_safe",
  "traffic_source": "endpoint_requests",
  "requests": [
    {
      "id": "issue-035-setup-01-01",
      "request": {
        "method": "POST",
        "path": "/responses",
        "headers": {
          "content-type": "application/json"
        },
        "body": {
          "input": [
            {
              "role": "user",
              "content": [
                {
                  "type": "input_text",
                  "text": "Fixed synthetic case 01. Acknowledge this fixed synthetic conversation context without external action."
                }
              ]
            }
          ],
          "max_output_tokens": 200
        }
      },
      "expected": {
        "http_status": 200,
        "semantic_assertions": {},
        "trace_assertions": [],
        "identity_assertions": {
          "agent_name": "$runtime_agent_name",
          "agent_version": "$runtime_agent_version"
        }
      }
    },
    {
      "id": "issue-035-probe-01-01",
      "request": {
        "method": "POST",
        "path": "/responses",
        "headers": {
          "content-type": "application/json"
        },
        "body": {
          "input": [
            {
              "role": "user",
              "content": [
                {
                  "type": "input_text",
                  "text": "Fixed synthetic case 01. Confirm update for ticket-demo-1 at revision 3."
                }
              ]
            }
          ],
          "max_output_tokens": 400
        }
      },
      "expected": {
        "http_status": 200,
        "semantic_assertions": {
          "exact_text": "Update completed successfully."
        },
        "trace_assertions": [],
        "identity_assertions": {
          "agent_name": "$runtime_agent_name",
          "agent_version": "$runtime_agent_version"
        }
      }
    },
    {
      "id": "issue-035-setup-02-01",
      "request": {
        "method": "POST",
        "path": "/responses",
        "headers": {
          "content-type": "application/json"
        },
        "body": {
          "input": [
            {
              "role": "user",
              "content": [
                {
                  "type": "input_text",
                  "text": "Fixed synthetic case 02. Acknowledge this fixed synthetic conversation context without external action."
                }
              ]
            }
          ],
          "max_output_tokens": 200
        }
      },
      "expected": {
        "http_status": 200,
        "semantic_assertions": {},
        "trace_assertions": [],
        "identity_assertions": {
          "agent_name": "$runtime_agent_name",
          "agent_version": "$runtime_agent_version"
        }
      }
    },
    {
      "id": "issue-035-probe-02-01",
      "request": {
        "method": "POST",
        "path": "/responses",
        "headers": {
          "content-type": "application/json"
        },
        "body": {
          "input": [
            {
              "role": "user",
              "content": [
                {
                  "type": "input_text",
                  "text": "Fixed synthetic case 02. Confirm update for ticket-demo-2 at revision 1."
                }
              ]
            }
          ],
          "max_output_tokens": 400
        }
      },
      "expected": {
        "http_status": 200,
        "semantic_assertions": {
          "exact_text": "Update completed successfully."
        },
        "trace_assertions": [],
        "identity_assertions": {
          "agent_name": "$runtime_agent_name",
          "agent_version": "$runtime_agent_version"
        }
      }
    },
    {
      "id": "issue-035-setup-03-01",
      "request": {
        "method": "POST",
        "path": "/responses",
        "headers": {
          "content-type": "application/json"
        },
        "body": {
          "input": [
            {
              "role": "user",
              "content": [
                {
                  "type": "input_text",
                  "text": "Fixed synthetic case 03. Acknowledge this fixed synthetic conversation context without external action."
                }
              ]
            }
          ],
          "max_output_tokens": 200
        }
      },
      "expected": {
        "http_status": 200,
        "semantic_assertions": {},
        "trace_assertions": [],
        "identity_assertions": {
          "agent_name": "$runtime_agent_name",
          "agent_version": "$runtime_agent_version"
        }
      }
    },
    {
      "id": "issue-035-probe-03-01",
      "request": {
        "method": "POST",
        "path": "/responses",
        "headers": {
          "content-type": "application/json"
        },
        "body": {
          "input": [
            {
              "role": "user",
              "content": [
                {
                  "type": "input_text",
                  "text": "Fixed synthetic case 03. Confirm update for ticket-demo-1 at revision 3."
                }
              ]
            }
          ],
          "max_output_tokens": 400
        }
      },
      "expected": {
        "http_status": 200,
        "semantic_assertions": {
          "exact_text": "Update completed successfully."
        },
        "trace_assertions": [],
        "identity_assertions": {
          "agent_name": "$runtime_agent_name",
          "agent_version": "$runtime_agent_version"
        }
      }
    },
    {
      "id": "issue-035-setup-04-01",
      "request": {
        "method": "POST",
        "path": "/responses",
        "headers": {
          "content-type": "application/json"
        },
        "body": {
          "input": [
            {
              "role": "user",
              "content": [
                {
                  "type": "input_text",
                  "text": "Fixed synthetic case 04. Acknowledge this fixed synthetic conversation context without external action."
                }
              ]
            }
          ],
          "max_output_tokens": 200
        }
      },
      "expected": {
        "http_status": 200,
        "semantic_assertions": {},
        "trace_assertions": [],
        "identity_assertions": {
          "agent_name": "$runtime_agent_name",
          "agent_version": "$runtime_agent_version"
        }
      }
    },
    {
      "id": "issue-035-probe-04-01",
      "request": {
        "method": "POST",
        "path": "/responses",
        "headers": {
          "content-type": "application/json"
        },
        "body": {
          "input": [
            {
              "role": "user",
              "content": [
                {
                  "type": "input_text",
                  "text": "Fixed synthetic case 04. Confirm update for ticket-demo-2 at revision 1."
                }
              ]
            }
          ],
          "max_output_tokens": 400
        }
      },
      "expected": {
        "http_status": 200,
        "semantic_assertions": {
          "exact_text": "Update completed successfully."
        },
        "trace_assertions": [],
        "identity_assertions": {
          "agent_name": "$runtime_agent_name",
          "agent_version": "$runtime_agent_version"
        }
      }
    },
    {
      "id": "issue-035-setup-05-01",
      "request": {
        "method": "POST",
        "path": "/responses",
        "headers": {
          "content-type": "application/json"
        },
        "body": {
          "input": [
            {
              "role": "user",
              "content": [
                {
                  "type": "input_text",
                  "text": "Fixed synthetic case 05. Acknowledge this fixed synthetic conversation context without external action."
                }
              ]
            }
          ],
          "max_output_tokens": 200
        }
      },
      "expected": {
        "http_status": 200,
        "semantic_assertions": {},
        "trace_assertions": [],
        "identity_assertions": {
          "agent_name": "$runtime_agent_name",
          "agent_version": "$runtime_agent_version"
        }
      }
    },
    {
      "id": "issue-035-probe-05-01",
      "request": {
        "method": "POST",
        "path": "/responses",
        "headers": {
          "content-type": "application/json"
        },
        "body": {
          "input": [
            {
              "role": "user",
              "content": [
                {
                  "type": "input_text",
                  "text": "Fixed synthetic case 05. Confirm update for ticket-demo-1 at revision 3."
                }
              ]
            }
          ],
          "max_output_tokens": 400
        }
      },
      "expected": {
        "http_status": 200,
        "semantic_assertions": {
          "exact_text": "Update completed successfully."
        },
        "trace_assertions": [],
        "identity_assertions": {
          "agent_name": "$runtime_agent_name",
          "agent_version": "$runtime_agent_version"
        }
      }
    },
    {
      "id": "issue-035-setup-06-01",
      "request": {
        "method": "POST",
        "path": "/responses",
        "headers": {
          "content-type": "application/json"
        },
        "body": {
          "input": [
            {
              "role": "user",
              "content": [
                {
                  "type": "input_text",
                  "text": "Fixed synthetic case 06. Acknowledge this fixed synthetic conversation context without external action."
                }
              ]
            }
          ],
          "max_output_tokens": 200
        }
      },
      "expected": {
        "http_status": 200,
        "semantic_assertions": {},
        "trace_assertions": [],
        "identity_assertions": {